<?xml version="1.0" encoding="utf-8" ?>
<!DOCTYPE Animations SYSTEM "../DTDs/Animations.dtd">
<Animations>
	<Style>Bow</Style>
	<Type>Distant</Type>
	<Attack_Animation_Filename>Human_w_Bow_Attack.xml</Attack_Animation_Filename>
	<Death_Animation_Filename>Human_w_Bow_Death.xml</Death_Animation_Filename>
	<Hit_Animation_Filename>Human_w_Bow_Hit.xml</Hit_Animation_Filename>
	<Run_Animation_Filename>Human_w_Bow_Run.xml</Run_Animation_Filename>
	<Stop_Animation_Filename>Human_w_Bow_Pause.xml</Stop_Animation_Filename>
	<Walk_Animation_Filename>Human_w_Bow_Walk.xml</Walk_Animation_Filename>
</Animations>
