<?xml version="1.0" encoding="utf-8" ?>

<!DOCTYPE Animations SYSTEM "../DTDs/Animations.dtd">

<Animations>
	<Style>Sword</Style>
	<Type>Melee</Type>
	<Attack_Animation_Filename>Human_w_Sword_Attack.xml</Attack_Animation_Filename>
	<Death_Animation_Filename>Human_w_Sword_Death.xml</Death_Animation_Filename>
	<Hit_Animation_Filename>Human_w_Sword_Hit.xml</Hit_Animation_Filename>
	<Run_Animation_Filename>Human_w_Sword_Run.xml</Run_Animation_Filename>
	<Stop_Animation_Filename>Human_w_Sword_Stop.xml</Stop_Animation_Filename>
	<Walk_Animation_Filename>Human_w_Sword_Walk.xml</Walk_Animation_Filename>
</Animations>
